<?xml version="1.0" encoding="UTF-8"?>
<!--
To change this license header, choose License Headers in Project Properties.
To change this template file, choose Tools | Templates
and open the template in the editor.
-->


<plateau
    xmlns:xsi='http://www.w3.org/2001/XMLSchema-instance'
    xmlns='http://lemaire/tux'
    xsi:schemaLocation='http://lemaire/tux file:/home/l/lemairlo/LangagePourLeWeb/TLG/xsd/plateau.xsd'>
    <dimensions>
        <height>
            100
        </height>
        <width>
            40
        </width>
        <depth>
            50
        </depth>
    </dimensions>
    <mapping>
        <textureBottom>
            textures/floor/grass2.png
        </textureBottom>
        <textureEast>
            textures/skybox/interstellar/east.png
        </textureEast>
        <textureWest>
            textures/skybox/interstellar/west.png
        </textureWest>
        <textureNorth>
            textures/skybox/interstellar/north.png
        </textureNorth>
    </mapping>
    <pion>
        une url
    </pion>

</plateau>
